{
  "$schema": "http://json-schema.org/draft-07/schema#",
  "$id": "https://just-deliver/schemas/release-record.schema.json",
  "title": "just-deliver release record",
  "description": "Written by `jd release deploy` and `jd release qualify`, one file per attempt, never edited: the local evidence of one attempt to put a release set on one environment, or to re-check it (docs/architecture/release-record.md). Holds no config and no output values: the graph is stored as hashes, change counts replace the changes. Workloads are in deploy order. A deploy has an outcome, a deploy time, the workloads not started, each workload's run and OQ, and an `iq` verdict (`notRun` when a workload failed); a qualify has only the `iq` verdict (passed or failed) and deployed nothing.",
  "type": "object",
  "additionalProperties": false,
  "required": ["kind", "activity", "startedAt", "finishedAt", "identity", "environment", "release", "workloads"],
  "oneOf": [
    {
      "description": "A deploy: the outcome, the deploy time, the workloads not started, each workload's OQ, and the IQ verdict, which is notRun when IQ did not run because a workload failed.",
      "properties": {
        "activity": { "enum": ["deploy"] },
        "workloads": { "items": { "required": ["oq"] } }
      },
      "required": ["outcome", "deploySeconds", "notStarted", "iq"]
    },
    {
      "description": "A qualification: the IQ verdict, which ran (passed or failed), and none of a deploy's fields, since it deployed nothing.",
      "properties": {
        "activity": { "enum": ["qualify"] },
        "iq": { "properties": { "status": { "enum": ["passed", "failed"] } } },
        "workloads": { "items": { "not": { "anyOf": [{ "required": ["run"] }, { "required": ["oq"] }] } } }
      },
      "required": ["iq"],
      "not": { "anyOf": [{ "required": ["outcome"] }, { "required": ["deploySeconds"] }, { "required": ["notStarted"] }, { "required": ["failure"] }] }
    }
  ],
  "properties": {
    "kind": { "enum": ["ReleaseRecord"] },
    "activity": { "enum": ["deploy", "qualify"] },
    "startedAt": { "$ref": "#/definitions/time" },
    "finishedAt": { "$ref": "#/definitions/time" },
    "outcome": { "enum": ["succeeded", "failed"] },
    "failure": {
      "description": "Present when the outcome is failed: the workload that failed and the node the walk stopped at (the runtime node when one of its steps failed).",
      "type": "object",
      "additionalProperties": false,
      "required": ["workload", "node"],
      "properties": {
        "workload": { "type": "string", "minLength": 1 },
        "node": { "type": "string", "minLength": 1 }
      }
    },
    "identity": {
      "description": "The principal the run authenticated with, as Entra reports it, never as any file or variable claims.",
      "type": "object",
      "additionalProperties": false,
      "required": ["tenantId", "clientId", "objectId"],
      "properties": {
        "tenantId": { "type": "string", "minLength": 1 },
        "clientId": { "type": "string", "minLength": 1 },
        "objectId": { "type": "string", "minLength": 1 }
      }
    },
    "environment": {
      "type": "object",
      "additionalProperties": false,
      "required": ["name", "tier", "region", "catalogVersion"],
      "properties": {
        "name": { "type": "string", "minLength": 1 },
        "tier": { "type": "string", "minLength": 1 },
        "region": { "type": "string", "minLength": 1 },
        "catalogVersion": { "type": "string", "minLength": 1 }
      }
    },
    "release": {
      "type": "object",
      "additionalProperties": false,
      "required": ["label", "createdAt", "setSha256"],
      "properties": {
        "label": { "type": "string", "minLength": 1 },
        "createdAt": { "$ref": "#/definitions/time" },
        "setSha256": { "description": "SHA-256 of the exact bytes of set.yaml beside the records.", "$ref": "#/definitions/sha256" }
      }
    },
    "iq": {
      "description": "Installation qualification: the deployment still matches its graphs (no drift) and every revision that serves traffic runs the pinned image. Every check that ran is listed; the status is failed when any failed, and notRun (no checks, no time) for a deploy that did not reach IQ.",
      "type": "object",
      "additionalProperties": false,
      "required": ["status", "elapsedSeconds", "checks"],
      "properties": {
        "status": { "enum": ["passed", "failed", "notRun"] },
        "elapsedSeconds": { "type": "number", "minimum": 0 },
        "checks": {
          "type": "array",
          "items": {
            "type": "object",
            "additionalProperties": false,
            "required": ["workload", "kind", "subject", "status", "detail"],
            "properties": {
              "workload": { "type": "string", "minLength": 1 },
              "kind": { "enum": ["drift", "image"] },
              "subject": { "description": "The node (drift) or revision (image) checked; the workload when there is none to name.", "type": "string", "minLength": 1 },
              "status": { "enum": ["passed", "failed"] },
              "detail": { "description": "Why it failed, naming the node or revision; empty when it passed.", "type": "string" }
            }
          }
        }
      }
    },
    "deploySeconds": { "description": "The deploy walk alone; started and finished bracket the whole activity.", "type": "number", "minimum": 0 },
    "notStarted": {
      "description": "Names of the workloads the run never reached because an earlier one failed.",
      "type": "array",
      "items": { "type": "string", "minLength": 1 }
    },
    "workloads": {
      "type": "array",
      "minItems": 1,
      "items": {
        "type": "object",
        "additionalProperties": false,
        "required": ["name", "team", "definitionSha256", "dependsOn", "image", "graph"],
        "properties": {
          "name": { "type": "string", "minLength": 1 },
          "team": { "type": "string", "minLength": 1 },
          "definitionSha256": { "$ref": "#/definitions/sha256" },
          "dependsOn": { "type": "array", "items": { "type": "string", "minLength": 1 } },
          "image": { "description": "The image reference, pinned by digest.", "type": "string", "minLength": 1 },
          "graph": {
            "type": "object",
            "additionalProperties": false,
            "required": ["sha256", "nodes"],
            "properties": {
              "sha256": { "description": "SHA-256 of the graph's stable JSON (GraphJson); equal hashes mean the same graph.", "$ref": "#/definitions/sha256" },
              "nodes": {
                "type": "array",
                "items": {
                  "type": "object",
                  "additionalProperties": false,
                  "required": ["id", "template", "stack", "phase", "hash"],
                  "properties": {
                    "id": { "type": "string", "minLength": 1 },
                    "template": { "type": "string", "minLength": 1 },
                    "stack": { "type": "string", "minLength": 1 },
                    "phase": { "enum": ["infrastructure", "runtime", "afterRuntime"] },
                    "hash": { "$ref": "#/definitions/sha256" }
                  }
                }
              }
            }
          },
          "run": {
            "description": "Absent when the workload was not started.",
            "type": "object",
            "additionalProperties": false,
            "required": ["elapsedSeconds", "nodes"],
            "properties": {
              "elapsedSeconds": { "type": "number", "minimum": 0 },
              "nodes": {
                "type": "array",
                "items": {
                  "type": "object",
                  "additionalProperties": false,
                  "required": ["id", "outcome", "changes", "message", "elapsedSeconds"],
                  "properties": {
                    "id": { "type": "string", "minLength": 1 },
                    "outcome": { "enum": ["deployed", "unchanged", "previewed", "pendingUpstream", "failed"] },
                    "changes": {
                      "description": "Resources per operation, as the provider counted them (the keys keep the provider's operation names, PascalCase: Create, Update, Same, ...); counts only, never the changed properties.",
                      "type": "object",
                      "additionalProperties": { "type": "integer", "minimum": 0 }
                    },
                    "message": { "description": "Why the node failed; empty otherwise.", "type": "string" },
                    "elapsedSeconds": { "type": "number", "minimum": 0 },
                    "steps": {
                      "description": "The runtime node's release steps that ran, in order.",
                      "type": "array",
                      "items": {
                        "type": "object",
                        "additionalProperties": false,
                        "required": ["step", "outcome", "detail", "elapsedSeconds", "attempts"],
                        "properties": {
                          "step": { "enum": ["dark", "grants", "probe", "shift"] },
                          "outcome": { "enum": ["done", "planned", "skipped", "failed"] },
                          "detail": { "type": "string" },
                          "elapsedSeconds": { "type": "number", "minimum": 0 },
                          "attempts": { "description": "The probe's attempts; 0 for every other step.", "type": "integer", "minimum": 0 }
                        }
                      }
                    }
                  }
                }
              }
            }
          },
          "oq": {
            "description": "Operational qualification, read from the runtime node's probe step: passed, failed, unchanged (the revision was already live; counts only with an earlier pass under the same label) or notRun.",
            "type": "object",
            "additionalProperties": false,
            "required": ["status", "contract"],
            "properties": {
              "status": { "enum": ["passed", "failed", "unchanged", "notRun"] },
              "contract": {
                "description": "What the probe checked, from the mapping.",
                "type": "object",
                "additionalProperties": false,
                "required": ["path", "expectedStatus"],
                "properties": {
                  "path": { "type": "string", "minLength": 1 },
                  "expectedStatus": { "type": "integer" }
                }
              },
              "detail": { "description": "Present when the probe ran: its last answer.", "type": "string" },
              "attempts": { "description": "0 when the step failed before any probe was sent (no fqdn to probe).", "type": "integer", "minimum": 0 },
              "elapsedSeconds": { "type": "number", "minimum": 0 }
            }
          }
        }
      }
    }
  },
  "definitions": {
    "time": { "description": "UTC, to the second.", "type": "string", "pattern": "^\\d{4}-\\d{2}-\\d{2}T\\d{2}:\\d{2}:\\d{2}Z$" },
    "sha256": { "type": "string", "pattern": "^[0-9a-f]{64}$" }
  }
}
